{
  "$id": "state.schema.json",
  "$schema": "https://json-schema.org/draft/2020-12/schema",
  "title": "Run State",
  "type": "object",
  "additionalProperties": false,
  "required": [
    "schema_version",
    "run_id",
    "phase",
    "completeness_state",
    "created_at",
    "timestamps",
    "repo_fingerprint_sha256",
    "codex",
    "phase_attempts"
  ],
  "properties": {
    "schema_version": {
      "const": 1
    },
    "run_id": {
      "type": "string",
      "pattern": "^[0-9]{8}T[0-9]{6}Z-[0-9a-f]{6}$"
    },
    "phase": {
      "enum": [
        "CREATED",
        "PREFLIGHT_COMPLETE",
        "CONTRACT_FROZEN",
        "OPUS_INDEPENDENT_COMPLETE",
        "CODEX_INDEPENDENT_COMPLETE",
        "NORMALIZED",
        "OPUS_CROSS_EXAM_COMPLETE",
        "CODEX_CROSS_EXAM_COMPLETE",
        "LEDGER_COMPLETE",
        "ADJUDICATION_COMPLETE",
        "FINALIZED",
        "COMPLETE"
      ]
    },
    "completeness_state": {
      "enum": [
        "RUNNING",
        "COMPLETE",
        "COMPLETE_WITH_RESIDUAL_UNCERTAINTY",
        "PARTIAL_CODEX_QUOTA",
        "PARTIAL_CODEX_FAILURE",
        "PARTIAL_CLAUDE_INTERRUPTION",
        "STALE_REPOSITORY",
        "INVALID_AUDIT_INPUT",
        "INVALID_AUDIT_ENVIRONMENT"
      ]
    },
    "created_at": {
      "type": "string",
      "format": "date-time"
    },
    "timestamps": {
      "type": "object",
      "additionalProperties": {
        "type": "string"
      }
    },
    "repo_fingerprint_sha256": {
      "type": "string"
    },
    "env_binding_digest": {
      "type": "string"
    },
    "repo_root": {
      "type": "string"
    },
    "model_selection": {
      "type": "object",
      "additionalProperties": {
        "type": "object",
        "additionalProperties": false,
        "required": [
          "auditor",
          "mode",
          "source",
          "model",
          "effort",
          "frozen_at",
          "selection_digest"
        ],
        "properties": {
          "auditor": {
            "enum": ["opus", "codex"]
          },
          "mode": {
            "enum": ["audit-default", "inherit", "explicit"]
          },
          "source": {
            "type": "string",
            "minLength": 1
          },
          "requested_model": {
            "type": ["string", "null"]
          },
          "requested_effort": {
            "type": ["string", "null"]
          },
          "model": {
            "enum": [
              "claude-opus-5-5",
              "claude-opus-5",
              "gpt-6.1-sol",
              "gpt-5.6-sol"
            ]
          },
          "effort": {
            "enum": ["high", "medium", "low", "minimal", "xhigh"]
          },
          "client_version": {
            "type": ["string", "null"]
          },
          "frozen_at": {
            "type": "string",
            "minLength": 1
          },
          "selection_digest": {
            "type": "string",
            "pattern": "^[0-9a-f]{64}$"
          }
        }
      }
    },
    "codex": {
      "type": "object",
      "additionalProperties": false,
      "required": [
        "session_id",
        "jobs",
        "stage_counts"
      ],
      "properties": {
        "session_id": {
          "type": [
            "string",
            "null"
          ]
        },
        "jobs": {
          "type": "array",
          "items": {
            "type": "object",
            "additionalProperties": true,
            "required": [
              "job_id",
              "phase"
            ],
            "properties": {
              "job_id": {
                "type": "string"
              },
              "phase": {
                "type": "string"
              },
              "pid": {
                "type": "integer"
              },
              "resumed": {
                "type": "boolean"
              },
              "status": {
                "type": "string"
              },
              "started_at": {
                "type": "string"
              }
            }
          }
        },
        "stage_counts": {
          "type": "object",
          "additionalProperties": false,
          "required": [
            "independent",
            "cross_examination",
            "adjudication"
          ],
          "properties": {
            "independent": {
              "type": "integer",
              "minimum": 0,
              "maximum": 1
            },
            "cross_examination": {
              "type": "integer",
              "minimum": 0,
              "maximum": 1
            },
            "adjudication": {
              "type": "integer",
              "minimum": 0,
              "maximum": 1
            }
          }
        }
      }
    },
    "phase_attempts": {
      "type": "object",
      "additionalProperties": {
        "type": "integer"
      }
    },
    "failure_reason": {
      "type": [
        "string",
        "null"
      ]
    },
    "adjudication_skipped": {
      "type": "boolean"
    },
    "phase_skips": {
      "type": "array",
      "items": {
        "type": "object",
        "additionalProperties": false,
        "required": ["skipped_phase", "reason", "recorded_at"],
        "properties": {
          "skipped_phase": {
            "enum": [
              "CONTRACT_FROZEN",
              "OPUS_INDEPENDENT_COMPLETE",
              "CODEX_INDEPENDENT_COMPLETE",
              "NORMALIZED",
              "OPUS_CROSS_EXAM_COMPLETE",
              "CODEX_CROSS_EXAM_COMPLETE",
              "LEDGER_COMPLETE",
              "ADJUDICATION_COMPLETE",
              "FINALIZED"
            ]
          },
          "reason": {
            "type": "string",
            "minLength": 1
          },
          "recorded_at": {
            "type": "string"
          },
          "from_phase": {
            "enum": [
              "CREATED",
              "PREFLIGHT_COMPLETE",
              "CONTRACT_FROZEN",
              "OPUS_INDEPENDENT_COMPLETE",
              "CODEX_INDEPENDENT_COMPLETE",
              "NORMALIZED",
              "OPUS_CROSS_EXAM_COMPLETE",
              "CODEX_CROSS_EXAM_COMPLETE",
              "LEDGER_COMPLETE",
              "ADJUDICATION_COMPLETE",
              "FINALIZED",
              "COMPLETE"
            ]
          },
          "to_phase": {
            "enum": [
              "CREATED",
              "PREFLIGHT_COMPLETE",
              "CONTRACT_FROZEN",
              "OPUS_INDEPENDENT_COMPLETE",
              "CODEX_INDEPENDENT_COMPLETE",
              "NORMALIZED",
              "OPUS_CROSS_EXAM_COMPLETE",
              "CODEX_CROSS_EXAM_COMPLETE",
              "LEDGER_COMPLETE",
              "ADJUDICATION_COMPLETE",
              "FINALIZED",
              "COMPLETE"
            ]
          },
          "consumed": {
            "type": "boolean"
          },
          "consumed_at": {
            "type": "string"
          }
        }
      }
    }
  }
}
