{
  "schema_version": 1,
  "run_id": "20260904T000000Z-abc123",
  "phase": "CREATED",
  "completeness_state": "RUNNING",
  "created_at": "2026-09-04T14:37:00Z",
  "timestamps": {
    "CREATED": "2026-09-04T14:37:00Z"
  },
  "repo_fingerprint_sha256": "0000000000000000000000000000000000000000000000000000000000000000",
  "repo_root": "/home/isa/audit-council-dev/skill/tests/fixtures/tele-v2-eb_2vg78/rd-cancel",
  "codex": {
    "session_id": null,
    "jobs": [],
    "stage_counts": {
      "independent": 0,
      "cross_examination": 0,
      "adjudication": 0
    }
  },
  "phase_attempts": {},
  "failure_reason": null,
  "adjudication_skipped": false
}
